Course Code,Title (TH),Title (EN),Created At
NPRU00387,โลจิสติกส์และธุรกิจระหว่างประเทศเบื้องต้น,Fundamentals of Logistics and International Business,2023
NPRU00386,กระบวนการพยาบาล,Nursing Process,2023
NPRU00385,นวัตกรรมและเทคโนโลยีสารสนเทศเพื่อการสื่อสารการศึกษาและการเรียนรู้,Innovation and Information Technology for Educational Communication and Learning,2022
NPRU00384,พลเมืองที่เข้มแข็ง,Active Citizen,2024
NPRU00383,การพยาบาลพื้นฐาน,Fundamental of Nursing,2022
NPRU00382,การบริหารจัดการในศตวรรษที่ 21,Management in 21st Century,2022
NPRU00381,เทคโนโลยีดิจิทัลและนวัตกรรม,Digital Technology and Innovation,2022
NPRU00380,ภาษาอังกฤษเพื่อการสื่อสารในสังคม,English for Social Communication,2022
NPRU00379,คอมพิวเตอร์กราฟิก,Computer Graphic,2021
NPRU00378,ภาษาจีนเพื่อการสื่อสาร,Chinese for Communication,2021
NPRU00377,ดูแลใส่ใจวัยสูงอายุ,Caring and Taking Care of the Elderly,2021
NOU00376,พูดภาษาจีน 300 ประโยค,Easy to Learn Mandarin (with 300 sentences),2023
NOU00375,โอกาสทางธุรกิจในเอเชียตะวันออก,Business Opportunities in East Asia,2020
NOU00374,Open Mind! สื่อใหม่แบบข้ามขอบเขตและการประชาสัมพันธ์อย่างสร้างสรรค์,Open Mind! Cross-Boundary New Media and Creative Public Relations&lt;,2021
NOU00373,การตลาดเชิงสร้างสรรค์,Creative Marketing,2020
NITIVAJRA00372,ความรู้เกี่ยวกับกระบวนการยุติธรรมทางอาญาในการดำเนินคดีทุจริตและประพฤติมิชอบ,Knowledge of Criminal Justice System in Conducting Corruption and Misconduct Cases,2023
NITIVAJRA00371,ความรู้เกี่ยวกับกระบวนการยุติธรรมทางอาญาในการดำเนินคดีความผิดเกี่ยวกับการค้ามนุษย์,Knowledge of Criminal Justice System in Conducting Human Trafficking Cases,2023
NITIVAJRA00370,ความรู้เกี่ยวกับการบังคับคดีให้หน่วยงานของรัฐ,Knowledge of Conducting Legal Execution for State Agencies,2023
NITIVAJRA00369,ความรู้เกี่ยวกับการดำเนินคดีแพ่งให้หน่วยงานของรัฐ,Knowledge of Conducting Civil Cases for State Agencies,2023
NITIVAJRA00368,ความรู้เกี่ยวกับกระบวนการยุติธรรมทางอาญาในการดำเนินคดียาเสพติด,Knowledge of Criminal Justice System in Conducting Narcotic Cases,2023
NIDA00367,การจัดเตรียมเนื้อหาสำหรับสื่อสังคมออนไลน์ และเว็บไซต์,Content Preparation for Social Media Platforms and Website,2023
NIDA00366,กลยุทธ์การตลาดเชิงเนื้อหาในสื่อสังคมเพื่อการจัดการแบรนด์ออนไลน์,Social Media Content Marketing Strategy for Online Brand Management,2023
NIDA00365,การจัดการสื่อสังคมออนไลน์ และการตลาดเชิงเนื้อหาบนพื้นฐานของข้อมูล,Data-driven Social Media Management and Content Marketing,2023
NIDA00364,Data + AI for Communication: PDPA การคุ้มครองข้อมูลส่วนบุคคล เตรียมความพร้อมเพื่อโอกาสทางธุรกิจ,Data + AI for Communication: PDPA for Business Opportunity,2022
NIDA00363,Data + AI for Communication: การใช้ Data + AI เพื่อเสริมพลังการสื่อสารการตลาด,Data + AI for Communication: Data + AI for Powered Marketing Communication,2022
NIDA00362,Data + AI for Communication: การฝึกปฏิบัติการการใช้เครื่องมือ Data + AI พื้นฐานสำหรับการสื่อสารการตลาด,Data + AI for Communication: Workshop on Data + AI Foundation Tools for Marketing Communication,2022
NIDA00361,Data + AI for Communication: เครื่องมือปัญญาประดิษฐ์สำหรับวิเคราะห์ข้อมูลพฤติกรรมผู้บริโภคเชิงลึก,Data + AI for Communication: Data Analytics Tool for AI marketing and Consumer Insight,2022
NIDA00360,Data + AI for Communication: ปัญญาประดิษฐ์กับสังคมมนุษย์,Data + AI for Communication: AI for Humanity,2022
NIDA00359,Data + AI for Communication: การประยุกต์ใช้ปัญญาประดิษฐ์ทางการสื่อสารเพื่อสร้างประสบการณ์ให้แก่ผู้บริโภค,Data + AI for Communication: AI Application for Experience Marketing Communication,2022
NIDA00358,Data + AI for Communication: การใช้ข้อมูลและปัญญาประดิษฐ์สำหรับวิสาหกิจขนาดกลางและขนาดย่อม,Data + AI for Communication: Data + AI for SME,2022
NIDA00357,Data + AI for Communication: Chatbot โดยไม่ต้องเขียนโปรแกรม,Data + AI for Communication: Build AI Chatbot without Programming,2022
NIDA00356,Data + AI for Communication: แนวทางการใช้ข้อมูลและเครื่องมือปัญญาประดิษฐ์สำหรับองค์กรด้านการสื่อสาร,Data + AI for Communication: Inspired Data + AI Applications for Communication Organization,2022
NIDA00355,การสร้างสรรค์เนื้อหาด้วยข้อมูล (Data) เพื่อเพิ่มคุณค่าขององค์กร,Content Creation in Digital Organization,2020
NESDC00354,ยุทธศาสตร์ชาติและการนำไปสู่การปฏิบัติ,National Strategy,2020
NCTU00353,เศรษฐศาสตร์สร้างสรรค์,Creative Essentials of Economics,2020
NCKU00352,การดูแลผู้สูงอายุ 3,Elderly Care III,2023
NCKU00351,การดูแลผู้สูงอายุ 2,Elderly Care II,2023
NCKU00350,การดูแลผู้สูงอายุ 1,Elderly Care I,2021
MU00349,การจัดการการท่องเที่ยวและการบริการในยุค 4.0,Tourism and Hospitality Management 4.0,2019
MU00348,วิทย์เพื่อชีวิต,Science for Life,2020
MU00347,การเป็นผู้ดูแลผู้สูงอายุ,Caregivers techniques,2020
MU00346,การอนุรักษ์ความหลากหลายและการใช้ประโยชน์ อย่างยั่งยืนของพรรณพืชป่าพื้นเมืองของไทย,The conservation and sustainable use of native Thai plants,2020
MU00345,สายด่วนฉุกเฉิน,Emergency Medical Service,2020
MU00344,กู้ชีพกู้ใจ…ใครๆ ก็ทำได้,Basic Life Support,2020
MU00343,การจัดการสาธารณภัย…ใครๆ ก็ต้องรู้!,Emergency Care in Mass Casualty Incident,2020
MU00342,ประวัติและตรวจร่างกาย...ใครคิดว่าไม่สำคัญ,History Interview and Physical Examination for Emergency Personal,2020
MU00341,ภัยพิบัติใกล้ตัว,Disasters Everywhere,2020
MU00340,การออกแบบโมเดลและงานพิมพ์ 3D โมเดลเพื่อการบริการชุมชน,3D Model design & printing for community service,2020
MU00339,การวิเคราะห์และตรวจสอบโครงสร้างคอนกรีตเสริมเหล็กในกรณีภัยพิบัติ,Reinforced Concrete for Earthquake Disaster Evaluation,2020
MU00338,การออกแบบวงจรดิจิทัล,Digital Circuit Design,2020
MU00337,การเรียนรู้วิชาคณิตศาสตร์แบบสะเต็มศึกษา,Learning Mathematics using STEM based approach,2020
MU00336,การจัดการเรียนรู้วิชาวิทยาศาสตร์แบบสะเต็มศึกษา,STEM Based Learning for Science,2020
MU00335,กลยุทธ์สู่ประชาคมอาเซียน: การเมือง เศรษฐกิจ และสังคม,"ASEAN Strategies: Politics, Economics, and Society",2020
MSU00331,ภูมิปัญญาอีสานจากใบลาน,Lean way of life Society,2021
MSU00330,อักษรไทยน้อยเบื้องต้น,Basic Thainoi Scriptures,2021
MJU00329,กระบวนการเลี้ยงปลาและการแปรรูปเพิ่มมูลค่าผลผลิตจากปลาและสาหร่าย,Sustainable aquaculture and value-added products from fish and seaweed,2021
MJU00328,ปศุสัตว์สร้างอาชีพ,Animal farming and farm management,2021
MJU00327,กระบวนการการผลิตเห็ดและพืชผักตามแนวทางเกษตรปลอดภัย,Mushroom and vegetable production via Good Agricultural Practice (GAP),2020
MJU00326,การประยุกต์ใช้ไอโอทีสำหรับธุรกิจ,Internet of Things Adoption in Business,2020
MICROSOFT00325,ทบทวนความรู้ ไมโครซอฟท์ เอ็กซ์เซลล์ เพื่อการทดสอบโดย Microsoft Office Specialist (MOS) Certificate,Microsoft Office Specialist (MOS) Certificate for Microsoft Excel (Tutorial),2021
MICROSOFT00324,ไมโครซอฟท์ เพาเวอร์ แอป (เครื่องมือสร้างบิซิเนสแอป โดยไม่ต้องเขียนโค้ด),Microsoft Power App (No Code Low Code),2021
MICROSOFT00323,ไมโครซอฟท์ เพาเวอร์ บีไอ (เครื่องมือวิเคราะห์ข้อมูลธุรกิจ),Microsoft Power BI,2021
MICROSOFT00322,ไมโครซอฟท์ เพาเวอร์พอยต์ (โปรแกรมนำเสนอชิ้นงาน),Microsoft PowerPoint,2021
MICROSOFT00321,ไมโครซอฟท์ เอ็กซ์เซลล์ (โปรแกรมการคำนวณ),Microsoft Excel,2021
MICROSOFT00320,ไมโครซอฟท์ เวิร์ด (โปรแกรมประมวลผลคำเพื่องานเอกสาร),Microsoft Word,2021
MICROSOFT00319,ทักษะความเข้าใจ การใช้เทคโนโลยีดิจิทัล และความมั่นคงปลอดภัยทางไซเบอร์,Digital Literacy and Cyber Security,2021
MFU00318,การนวดสุคนธบำบัด,Aromatherapy Massage,2020
MFU00317,การจัดการท่องเที่ยวเพื่อความสนใจพิเศษ,Special Interest Tourism,2021
KUJ00313,เรียน “ญี่ปุ่นปัจจุบัน” ผ่านระบบ e-learning,“Japan Affairs” using e-learning,2020
KU00312,ปัญหาพิเศษ,Special Problems,2022
KU00311,การออกแบบและพัฒนาสื่อดิจิทัลและนวัตกรรมเพื่อการเรียนรู้,Instructional Innovation and Media Design and Development,2022
KU00309,การตรวจสอบคุณภาพของเครื่องมือวัดและประเมินผล,Validation of Measurement and Evaluation Tools,2020
KU00308,จากแนวคิดวิจัยสู่การปฏิบัติ,Research Concepts to Practice,2020
KU00307,ภาษาอังกฤษฟัง-พูดเชิงวิชาการสำหรับบัณฑิตศึกษา,Academic English Listening and Speaking Skills for Graduate Program,2020
KU00306,ภาษาอังกฤษอ่าน-เขียนเชิงวิชาการสำหรับบัณฑิตศึกษา,Academic Reading and Writing English for Graduate Program,2020
KU00305,นวัตกรรมและเทคโนโลยีดิจิทัลเพื่อการศึกษา,Innovation and Digital Technology for Education,2020
KU00304,เคมีทั่วไป,General Chemistry,2021
KU00303,ฟิสิกส์ทั่วไป I,General Physics I,2020
KU00302,คณิตศาสตร์วิศวกรรม II,Engineering Mathematics II,2020
KMUTT00301,การรายงานอุบัติเหตุและเหตุการณ์บนเรือ (การเขียนรายงาน),What happened? (Written/Report),2023
KMUTT00300,การรายงานอุบัติเหตุและเหตุการณ์บนเรือ (การโต้ตอบบทสนทนา),What happened? (Oral),2023
KMUTT00299,การบอกทิศทางระหว่างเดินเรือ,Keep Moving,2023
KMUTT00818,การปฏิบัติงานบนเรือ,Work Task on Board,2023
KMUTT00817,การตรวจสอบ แก้ปัญหาและบำรุงรักษาเชือกเรือ,What can I do with this rope?,2023
KMUTT00296,การตรวจสอบและบำรุงรักษาสมอเรือ,"Watch out, the anchor!",2023
KMUTT00295,การสอบถามข้อมูลเรือและข้อมูลการเข้าเมือง,Welcome to Thailand (for Homeland and Coastguard Officers),2023
KMUTT00816,การต้อนรับผู้มาเยือนบนเรือสำหรับเจ้าหน้าที่ประจำเรือ,Welcome on Board (for ship officers),2023
KMUTT00293,ไพธอนเพื่อการวิเคราะห์ข้อมูลและการนำเสนอข้อมูล (ตอนที่ 2),Python for Data Analysis and Data Visualization (Part 2),2023
KMUTT00292,ไพธอนเพื่อการวิเคราะห์ข้อมูลและการนำเสนอข้อมูล (ตอนที่ 1),Python for Data Analysis and Data Visualization (Part 1),2023
KMUTT00291,ไพธอนพื้นฐานสำหรับผู้เริ่มต้น,Python for beginners,2023
KMUTT00290,เทคนิคการวิเคราะห์เบื้องต้น (ตอนที่ 2),Introduction to Analysis Techniques (Part 2),2023
KMUTT00289,เทคนิคการวิเคราะห์เบื้องต้น (ตอนที่ 1),Introduction to Analysis Techniques (Part 1),2023
KMUTT00288,พื้นฐานการนำเสนอข้อมูลด้วยภาพ,Data Visualization Foundation,2023
KMUTT00287,การวิเคราะห์ข้อมูลเบื้องต้น ด้วย โปรแกรม MS Excel,Introduction to data analytics using MS Excel,2023
KMUTT00286,สถิติพื้นฐานสำหรับการวิเคราะห์ ข้อมูล-สถิติเชิงพรรณนา,Basic Statistics for Data Analytics – Descriptive Statistics,2023
KMUTT00285,การเตรียมข้อมูล,Data Preparation,2023
KMUTT00284,กระบวนการวิเคราะห์ข้อมูลเบื้องต้น,Introduction to data analytics process,2023
KMUTT00283,การถ่ายภาพขั้นสูง,Advance Photography,2022
KMUTT00282,ระบบการเรียนรู้และการสื่อสารผ่านระบบเครือข่าย,Learning System and Communication Through Networking,2022
KMUTT00281,นวัตกรรมการเรียนรู้ในงานอาชีวศึกษา,Innovation and Technology in Vocational Education,2020
KMUTT00280,รู้รอบด้านการนำเสนอ,About the Presentation,2020
KMUTT00279,การสร้างสรรค์สื่อดิจิทัลบนเครือข่ายสังคมออนไลน์,Digital media creation on social networks,2020
KMUTT00278,เทคโนโลยีกับการเรียนรู้ของเกษตรกรดิจิทัล,Technology and learning of digital agriculture.,2020
KMUTT00277,การเขียนโปรแกรมคอมพิวเตอร์พื้นฐาน ด้วยภาษาซี 1,Fundamentals of the C Programming Language I,2020
KMUTT00276,หุ่นยนต์เคลื่อนที่ขนาดเล็กควบคุม ด้วยไมโครคอนโทรลเลอร์,A small mobile robot controlled by a microcontroller,2020
KMUTT00275,การศึกษาที่เน้นผลลัพธ์การเรียนรู้,Outcome based education,2020
KMUTT00274,การถ่ายภาพทางอากาศยานโดยอากาศยานไร้คนขับ (โดรน),Aerial Photography by Drone,2020
KMUTT00273,การถ่ายภาพขั้นสูงเพื่องานโฆษณา,Advanced Photography for Advertising,2020
KMUTT00272,การผลิตรายการโทรทัศน์,Television Program Production,2020
KMUTT00271,การออกแบบกราฟิกโดยใช้คอมพิวเตอร์,Computer Based Graphics Design,2020
KMUTT00270,การออกแบบสื่อเพื่อการโฆษณา,Media Design for Advertising,2020
KMUTT00269,แอนิเมชั่น 3 มิติ ขั้นเริ่มต้น-ขั้นกลาง,3ds Animation Foundation,2020
KMUTT00268,ปรัชญาอาชีวศึกษาและความเป็นครู,Philosophy of Vocational Education and Teaching Professionalism,2020
KMUTT00267,เทคโนโลยีระบบรางและการจัดการการขนส่ง,Railway Technology and Transportation Management,2020
KMUTT00266,การออกแบบวงจรลำดับ,Sequential Circuit Design,2020
KMUTT00265,การอ่านแบบ เขียนแบบทางวิศวกรรมโยธา,Civil Engineering Drawing and Reading,2020
KMUTNB00264,เทคโนโลยีซ่อมบำรุงโรงงาน,Plant Maintenance Technology,2020
KMUTNB00263,การสร้างนวัตกรรมทางการศึกษาด้วยเทคโนโลยี Augmented Reality (AR),Developing Educational Innovation with Augmented Reality,2020
KMITL00262,การท่องเที่ยวโดยชุมชน,Community Based Tourism,2020
KMITL00261,การจัดการเลี้ยงดูสัตว์เลี้ยงสวยงาม,Pet Management,2020
KMITL00260,การเพาะเลี้ยงสาหร่ายสู่ธุรกิจเงินล้าน,Algal Cultivation,2020
KMITL00259,โมชั่นกราฟิกพื้นฐาน,Foundation of Motion Graphic,2020
KMITL00258,การผลิตหนังสั้น,Short Film Production,2020
KMITL00257,การถ่ายภาพด้วยเทคนิคสร้างสรรค์,Creative Photography,2020
KMITL00256,การถ่ายภาพบุคคล,Portrait Photography,2020
KMITL00255,การเลี้ยงสัตว์เบื้องต้น,Principle of Animal Husbandry,2020
KMITL00254,การปลูกพืชเบื้องต้น,Principle of Crop Production,2020
KMITL00253,หลักเศรษฐศาสตร์เกษตร,Principles of Agricultural Economics,2020
KMITL00252,หลักและวิธีการส่งเสริมการเกษตร,Principles of Agricultural Extension,2020
KMITL00251,คอมพิวเตอร์เพื่อการพูดและการนำเสนอ,Computer for Speech and Presentations,2020
KMITL00250,สร้างสรรค์สื่อวีดิทัศน์ยุคใหม่,Creative Video Production,2020
KMITL00249,การถ่ายภาพเบื้องต้น,Basic Photography,2020
KKU00803,นวัตกรรมและเทคโนโลยีสารสนเทศเพื่อการเรียนรู้,Innovation and Information Technology for Learning,2021
KKU00248,ทักษะคอมพิวเตอร์และเทคโนโลยีสารสนเทศและการสื่อสาร,Computer and ICT literacy Skills,2021
KKU00247,ทักษะการเรียนรู้,Learning skills,2021
KKU00246,การออกแบบและพัฒนาสิ่งแวดล้อมทางการเรียนรู้สำหรับการเรียนรู้ยุคใหม่,Design and Development of Learning Environment for Learning a New Era,2021
KKU00245,การออกแบบและผลิตสื่อมัลติมีเดียการศึกษา,Design and Production of Multimedia Education,2021
KKU00244,การผลิตวรรณกรรมสำหรับเด็กและเยาวชน generation ใหม่,Production of Children and Youth Literature for New Generation,2021
KKU00243,เทคโนโลยีอาหารและกระบวนการผลิตยุคใหม่,Food Technology & Processing in New Era,2021
KKU00242,นวัตกรรม และเทคโนโลยีสารสนเทศอุบัติใหม่ทางการศึกษา,Innovation and Emerging Information Technological Education,2021
KKU00241,วิธีการสอนโดยใช้เทคโนโลยีอุบัติใหม่เป็นฐานสำหรับการศึกษาในศตวรรษที่ 21,Technology-based Emerging Padagogy for 21st century Education,2021
KKU00240,โปรแกรมคอมพิวเตอร์และขั้นตอนวิธีทางคอมพิวเตอร์,Computer Programming and Algorithms,2021
KKU00239,การจัดการเทคโนโลยีสารสนเทศทางการเกษตรร่วมสมัย,Information Technology Management in Contemporary Agriculture,2021
KKU00238,เทคโนโลยีคอมพิวเตอร์และการจัดการสารสนเทศเพื่อสังคมและเศรษฐกิจ,Computer Technology and Information Management for Society and Economics,2021
KKU00237,ภาษาอังกฤษสำหรับเทคโนโลยีสารสนเทศ,English for information technology,2021
IPST00227,Coding for All - ฉลาดคิด พิชิตยุคดิจิทัล,Coding for All - Thinking smart toward the digital age,2023
IHPP00226,การขึ้นทะเบียนยาสามัญในต่างประเทศ,Common Technical Document (CTD) of Generic Drug Registration in the international countries,2022
ICCS00214,ชีวิตและการสร้างคุณค่า,Life and Value Creation,2024
ICCS00199,กระบวนการคิดเชิงออกแบบกับการพัฒนาทักษะการเรียนรู้ในศตวรรษที่ 21,Design thinking and 21st Century Learning Skills Development,2023
ICCS00198,ชุมชนแห่งความยั่งยืน,Sustainable community,2023
