Course Code,Title (TH),Title (EN),Created At
WU00774,ภาษาไทยเพื่อการสื่อสารร่วมสมัย,Thai for Contemporary Communication,2020
WU00773,บริการสารสนเทศสำหรับองค์กรดิจิทัล,Information Services for Digital Organization,2020
WU00772,เมทาดาทาสำหรับการจัดระบบสารสนเทศดิจิทัล,Metadata for Organizing Digital Information,2020
WU00771,กฎหมายอาญาและกฎหมายแพ่งและพาณิชย์สำหรับผู้บริการสุขภาพ,Criminal Law and Civil and Commercial Law for Healthcare Workers,2020
WU00770,การสืบค้นข้อมูลเพื่อการค้นคว้าและเขียนรายงาน,Searching information for research report,2020
WU00769,การแสวงหาความรู้สำหรับผู้เรียนในศตวรรษที่ 21,Knowledge Inquiry for development the 21st Century Skills,2020
WU00768,อินเทอร์เน็ตของสรรพสิ่ง : จากแนวคิดไปสู่ผลิตภัณฑ์,Internet of Things : from idea to product,2020
WU00767,เครื่องมือออนไลน์เพื่อการเรียนรู้ในศตวรรษที่ 21,Online Tools for 21st Century Learning,2020
WU00766,อาหารไทยเพื่อสุขภาพและการชะลอวัย,Thai Food for Health and Anti-Aging,2020
WU00765,การเตรียมสหกิจศึกษา,Pre Cooperative Education,2019
WU00764,จิตวิทยาพัฒนาการวัยรุ่น,Developmental Psychology in Adolescent,2020
WU00763,จิตวิทยาพัฒนาการวัยสูงอายุ,Developmental Psychology in Elderly,2020
WU00762,ความคิดสร้างสรรค์และนวัตกรรม,Creative Thinking and Innovations,2020
WU00761,เทคโนโลยีสารสนเทศสำหรับปัจจุบันและอนาคต,IT for the Present and Beyond,2020
UTCC00760,หลักการบัญชี,Principles of Accounting,2021
UTCC00759,การวางแผนและออกแบบการขนส่ง,Transportation Planning and Design,2021
URU00048,การเป็นผู้ประกอบการในศตวรรษที่ 21,Entrepreneurship in 21 st-Century,2020
URU00050,ปรัชญาเศรษฐกิจพอเพียง,Philosophy of Sufficiency Economy,2020
URU00049,เศรษฐศาสตร์เพื่อการดำเนินชีวิตอย่างมีความสุข,Economics for happy living,2020
UP00755,การสื่อสารในสังคมดิจิทัล,Communication in Digital Societ,2021
UP00754,การใช้ภาษาไทย,Using of Thai Language,2021
UP00753,ภาษาอังกฤษเตรียมพร้อม,Ready English,2020
UP00752,ภาษาอังกฤษสู่โลกกว้าง,Explorative English,2020
TU00014,การแก้ไขปัญหาด้วยการใช้ความคิดสร้างสรรค์,Creative Problem-solving,2021
TU00028,การจัดการตนเองสู่ประสิทธิภาพอย่างมืออาชีพ,Self-Management for professional productivity,2021
TU00013,การตัดสินใจโดยการขับเคลื่อนด้วยข้อมูล,Data - Driven Decision Making,2021
TU00012,ความหลากหลายในสถานที่ทำงาน,Diversity at workplace,2021
TU00011,ความเป็นพลเมืองโลก,Global Citizenship,2021
TSU00746,วัฒนธรรม วิถีชีวิต ประเพณีและความเชื่อในภาคใต้,Culture tradition and believe in Southern of Thailand,2020
TSU00745,ศิลปะ หัตกรรม และการละเล่นพื้นบ้านภาคใต้,Arts handicrafts and Southern folk play,2020
TSU00744,ทักษิณศึกษา,Southern Thai studies (Local wisdom of the South Thailand,2020
TKU00743,สำรวจการกำกับดูแลกิจการของบริษัท,Exploring Corporate Governance,2024
TKU00742,ความรู้ความสามารถและความคิดของ AI,Thinking and Literacy of Artificial Intelligence,2023
TKU00741,เศรษฐกิจหมุนเวียน,Circular Economy,2023
THAIPBS00736,งานสื่อสารสาธารณะเพื่อหาทางออกของสังคม,Solutions & Civic Journalism,2022
THAIPBS00735,การทำสารคดีในแบบสื่อสาธารณะ,Making Documentary for Public Media,2022
THAIPBS00734,จริยธรรมและวิชาชีพสื่อมวลชน,Ethic and Mass Media Profession,2021
THAIPBS00733,สื่อพลเมือง,Citizen Media,2021
THAIPBS00732,เทคนิคการถ่ายภาพในแบบสื่อสาธารณะ,Shooting techniques for Public Media,2021
THAIMOOC00731,SPU005-EN : เทคโนโลยีเสริมการสอน ในยุค Digital,Technology Enhanced Learning for Digital Era,2021
THAIMOOC00730,CU023-KR : 데이터 과학과 그 응용,Data Science Essential and Applications,2021
THAIMOOC00729,MFU001-KR : 특수 목적 관광,Special Interest Tourism,2021
THAIMOOC00728,CMU030-KR : 문화관광경영,Cultural Management for Tourism,2021
THAIMOOC00727,CMU030-EN : การจัดการวัฒนธรรมเพื่อการท่องเที่ยว,Cultural Management for Tourism,2021
THAIMOOC00726,CMU014-KR : 란나 음식,Northern Thai Food,2021
THAIMOOC00725,CMU014-EN : อาหารล้านนา,Northern Thai Food (English Caption),2021
THAIMOOC00724,การสร้างและการจัดการรายวิชา Thai MOOC,Creating and Managing a course for Thai MOOC,2023
THAIMOOC00723,การผลิตวิดีทัศน์สำหรับรายวิชา Thai MOOC,Video Production for Thai MOOC,2023
THAIMOOC00722,การออกแบบรายวิชา Thai MOOC,Instructional Design for Thai MOOC,2023
TBJA00719,ทักษะนักข่าวในยุคดิจิทัล,Journalists' survival guide in Digital age,2022
TAT00716,การตลาดท่องเที่ยวอย่างรับผิดชอบ,Responsible Tourism Marketing,2023
SWU00715,การออกแบบกราฟิกเพื่อการเรียนการสอน,Instructional Graphic Design,2022
SWU00714,การใช้เทคโนโลยีเพื่อส่งเสริมการเรียนรู้,Using Technology to Enhance Learning,2022
SWU00713,ระบบสมองกลฝังตัวและเทคโนโลยีอินเทอร์เน็ตของสรรพสิ่ง,Embedded System and Internet of Things Technology,2021
SWU00712,วิทยาการข้อมูล,Data Science,2020
SWU00711,จิตวิทยาข้ามวัฒนธรรมในที่ทำงาน,Cross-cultural psychology at work,2020
SWU00710,สร้างแบรนด์ดีด้วย R.I.C.H.,Building Good Brand with R.I.C.H.,2020
SWU00709,การออกแบบ Infographic,Infographic Design,2020
SWU00708,การใช้เทคโนโลยีเพื่อการพัฒนางานวิจัย,Use of technology for research development,2020
SWU00707,การสร้างคลังสื่อการเรียนรู้ออนไลน์,Creating Online Learning Resources,2020
SWU00706,Online Classroom ห้องเรียนยุคใหม่,Online Classroom in the 21st century,2020
SWU00705,ภาวะผู้นำการเปลี่ยนแปลงในศตวรรษที่ 21,The change of leadership in the 21st century,2021
SWU00704,การพัฒนาสมรรถนะครูในยุคดิจิทัล,Competency for teacher in digital age,2020
SWU00703,การหลอมรวมเทคโนโลยีสมัยใหม่,Fusion of modern technology,2021
SWU00702,การสร้างเครือข่ายด้วยการสื่อสารผ่าน Social Media,Network Creating with Communication in Social Media,2020
SWU00701,Cloud Technology Tools เพื่อการเรียนรู้ในศตวรรษที่ 21,Cloud Technology Tools for 21st Century Learning,2020
SWU00700,เทคโนโลยีเพื่อการเรียนรู้อย่างสร้างสรรค์,Technology for Creative Learning,2021
SWU00699,ผู้ประกอบการเพื่อสังคมเบื้องต้น,Introduction to Social Entrepreneurship,2020
SUT00698,การประยุกต์ใช้งานและอันตรายของแม่เหล็กไฟฟ้า,Application and danger of Electromagnetic,2020
SUT00697,การเขียนโปรแกรมคอมพิวเตอร์เบื้องต้น สำหรับระบบสารสนเทศ,Basic Computer Programming for Information System,2020
SUT00696,คณิตศาสตร์เพื่อคอมพิวเตอร์,Mathematics for Computer,2020
SU00695,สื่อสมัยใหม่เพื่อการเรียนรู้,New Media for Learning,2022
SU00694,เทคโนโลยีกับการศึกษาร่วมสมัย,Technology and Contemporary Education,2022
SU00693,วิจัยทางเทคโนโลยีการศึกษา,Research in Educational Technology,2022
SU00692,การออกแบบระบบการสอนทางเทคโนโลยีการศึกษา,Instruction System Design in Educational Technology,2022
SU00691,ทักษะการเขียนโปรแกรมคอมพิวเตอร์ด้วยภาษาซี,Computer programming skills with C language,2021
SU00690,ศิลปะศิลปากร,Silpakorn Arts,2020
SU00689,มนุษย์กับศิลปะ,Man and Art,2020
SU00688,พลเมืองดิจิทัล,Digital Citizenship,2020
SU00687,เทคโนโลยีสารสนเทศสำหรับการจัดการจดหมายเหตุและสารสนเทศมรดกทางวัฒนธรรม,Information Technology for Archives and Cultural Heritage Information Management,2020
SU00686,เทคโนโลยีและนวัตกรรมการศึกษา,Technology and Innovation for Education,2021
SU00685,การออกแบบภาพประกอบสื่อสําหรับเด็ก,Children’s Illustration Design,2021
SU00684,การวิจัยทางการศึกษา,Educational Research,2020
SU00683,เทคนิควิธีการจัดการเรียนรู้,Technique and Method of instruction,2021
SU00682,มนุษย์กับสิ่งแวดล้อม,Human and His Environment,2021
SU00681,กิจกรรมเคลื่อนไหวเชิงสร้างสรรค์สำหรับเด็กปฐมวัย,Creative Movement Activities for Young Children,2021
STOU00680,การสร้างต้นแบบโมเดลธุรกิจอย่างมืออาชีพ,The Professional Creation of a Business Model Prototype,2023
STOU00679,การสร้างความคิด เพื่อพิชิตลูกค้า,The Creation of Thinking to Win the Customers,2023
STOU00678,ตั้งกรอบโจทย์อย่างไร...ให้โดนใจลูกค้า,How to Post an Attractive Problem Framework for the Customers,2023
STOU00677,ปฏิบัติการคิดเชิงออกแบบนวัตกรรม,A Thinking Workshop on Innovation Design,2023
STOU00676,การใช้เทคโนโลยีดิจิทัลเพื่อการติดต่อสื่อสารและการสร้างสรรค์งานสำหรับผู้ดูแลผู้สูงอายุ,Using digital technology for communication and creative work for elderly caregivers,2021
STOU00675,ความรู้เรื่องการเงินสำหรับผู้ดูแลผู้สูงอายุ,Financial Literacy for Elderly Caregivers,2021
STOU00674,กฎหมายแรงงานสำหรับผู้ดูแลผู้สูงอายุ,Labour Law for Elderly Caregivers,2021
STOU00673,บทบาท หน้าที่ ความรับผิดชอบ และการดูแลตนเองสำหรับผู้ดูแลผู้สูงอายุ,"Role, Function, Responsibilities and Self Care for Elderly Caregivers",2021
STOU00672,โรคเรื้อรังและกลุ่มอาการที่พบบ่อยสำหรับผู้ดูแลผู้สูงอายุ,Common Chronic Diseases and Syndromes for Elderly Caregivers,2021
STOU00671,การจัดการภาวะฉุกเฉินในผู้สูงอายุ,Emergency Management in Elderly People,2021
STOU00670,การปฐมพยาบาลผู้สูงอายุ,First Aid for the Elderly,2021
STOU00669,การดูแลระบบทางการหายใจ ระบบทางเดินอาหารและระบบการขับถ่ายปัสสาวะของผู้สูงอายุ สำหรับผู้ดูแลผู้สูงอายุ,"Respiratory Care System,Gastrointestnal Care System and Excretory Care System for Elderly Caregivers",2021
STOU00668,การประเมินสัญญาณชีพ การใช้ยา และการป้องกันการติดเชื้อ สำหรับผู้ดูแลผู้สูงอายุ,"Assessment, Medication Use, and Infection Prevention for Elderly Caregivers",2021
STOU00667,การดูแลสุขวิทยาส่วนบุคคลและการเคลื่อนย้ายผู้สูงอายุสำหรับผู้ดูแลผู้สูงอายุ,"Personal hygiene, Lifting, Moving",2021
STOU00666,ภูมิปัญญาไทยกับการดูแลผู้สูงอายุสำหรับผู้ดูแลผู้สูงอายุ,Caring for the Elderly by Using Thai wisdom for Elderly Caregivers,2021
STOU00665,การส่งเสริมสุขภาพจิตผู้สูงอายุด้วยเทคนิคแบบบูรณาการสำหรับผู้ดูแลผู้สูงอายุ,Mental Health Care Enhancement in Elderly with Integrative Techniques for Elderly Caregivers,2021
STOU00664,การจัดสภาพแวดล้อมที่ดี ถูกสุขอนามัย ปลอดภัย และน่าอยู่ สำหรับผู้ดูแลผู้สูงอายุ,"Environmental Friendliness in Hygiene, Safety, and Comfort for Elderly Caregivers",2021
STOU00663,การดูแลโภชนาการอย่างปลอดภัยและถูกสุขอนามัยสำหรับผู้ดูแลผู้สูงอายุ,Elderly Caring in Nutritional Care with the Safety and Hygiene in the Elderly for Elderly Caregivers,2021
STOU00662,การดูแลผู้สูงอายุแบบองค์รวม,Holistic Approach on Aging Care,2021
STOU00661,ระบบสารสนเทศกับการจัดการความรู้ในยุคดิจิทัล,Information System and Knowledge Management in the Digital Age,2020
STOU00660,ศาสตร์แห่งการชะลอวัย,Science of active aging,2020
STOU00659,สื่อสารอย่างไรให้สมาร์ตในยุคดิจิทัล,Smart communication in Digital Age,2020
STOU00658,ภูมิปัญญาไทย กับการพัฒนาการเกษตรอย่างยั่งยืน,Thai wisdom with agricultural sustainable development,2020
STOU00657,Young Smart Farmer ยุคไทยแลนด์ 4.0,Young Smart Farmers in Thailand 4.0,2020
STOU00656,สถิติธุรกิจ (สถิติเรื่องใกล้ตัว...ไม่น่ากลัวอย่างที่คิด),Business Statistic,2020
STOU00655,การพูด การแสดงทางวิทยุกระจายเสียงอย่างมืออาชีพ,Radio Performance,2020
STOU00654,เอสเอ็มอี สตาร์ทอัพ,SME Startup,2020
STOU00653,การส่งเสริมสุขภาพผู้สูงอายุ,Health Promotion for Older People,2020
STOU00652,การสร้างวินัยในตนเอง...สำหรับเด็กปฐมวัย,Promoting Early Childhood Children’ Self-Discipline,2020
STOU00651,การผู้ดูแลผู้สูงอายุ...เพื่อป้องกันภาวะความเสี่ยงจากโรคสมองเสื่อม,Elderly Caregivers...Reducing Risk of Dementia,2020
STOU00650,คณิตเศรษฐศาสตร์และเศรษฐมิติเพื่อการธุรกิจ,Mathematical Economics and Econometrics for Business,2020
STOU00649,กฎหมายอาญาภาคความผิด (มาตรา 309-398),Criminal Law : Offenses (Penal Code Section 309 – 398),2020
STOU00648,การออกแบบผลิตภัณฑ์สำหรับผู้ประกอบการ,Product Design for Entrepreneur,2020
STOU00647,เทคโนโลยีการสร้างสรรค์สื่อดิจิทัล,Digital Media Creation Technology,2020
STOU00646,ความรู้พื้นฐานเกี่ยวกับบิ๊กดาตา,Big Data Concept,2020
STOU00645,การบัญชีเพื่อการจัดการและการจัดการทางการเงิน,Managerial Accounting and Financial Management,2020
STOU00644,การจัดการเชิงกลยุทธ์และการตลาดในยุคโลกาภิวัตน์,Strategic Management and Marketing in a Globalized Era,2020
STOU00643,พฤติกรรมองค์การและการจัดการทรัพยากรมนุษย์,Organizational Behavior and Human Resource Management,2020
STOU00642,ระบบหลักประกันสุขภาพไทย,Thai Health Security,2020
STOU00641,ภาษาญี่ปุ่นเพื่ออาชีพผู้ดูแลผู้สูงอายุ,Japanese Language for Being Elderly Caregiver,2020
STOU00640,ภาษาจีนเพื่อการท่องเที่ยว,Chinese Language for Tourism,2020
STOU00639,พื้นฐานนักออกแบบแฟชั่นสำหรับชุมชน,Basic Fashion Designer Community,2020
STOU00638,ศิลปะการปรุงอาหาร,Food Design,2020
STOU00637,ธุรกิจบริการสปาและการประยุกต์งานแพทย์แผนไทย,Business Services Spa & Traditional Thai Medicine,2020
STCC00802,ท่องเที่ยวชุมชน,Community tour,2020
STOU00636,ชุมชนไอดอล,Idol Community,2020
STOU00635,ชีวิตทันยุค,Start Up Life,2020
STOU00634,พื้นที่จุดประกาย,Start Up Space,2020
STOU00633,สตาร์ทอัพชุมชน,Community Start Up,2020
STOU00632,รู้จักสื่อ...รู้จักอาเซียน,Smart Comm. ASEAN,2020
STOU00631,สตาร์ทอัพอังกฤษ,English Start Up,2020
STC00629,ภาษาอังกฤษเทคโนโลยีช่างอุตสาหกรรม,English for Industrial Technology,2020
SSRU00628,คณิตพิชิต O-NET (ระดับม.ต้น),Math Conquer O-NET (Junior High School),2019
SSRU00627,การออกแบบสื่ออินเตอร์แอคทีฟเพื่อการศึกษา,Design Interactive Media for Education,2020
SSRU00626,การออกแบบสื่อเสียงเพื่อการศึกษา,Design Audio Media for Education,2020
SSRU00625,หลักพุทธธรรม,Buddhist Principles,2020
SSRU00624,ประวัติศาสตร์ยุโรป,European History,2020
SSRU00623,อาเซียนศึกษา,ASEAN Studies,2020
SSRU00622,เพศศึกษารอบด้าน,Comprehensive Sexuality,2020
SRU00621,การออกแบบกิจกรรมการเรียนรู้เพื่อพัฒนาอัตมโนทัศน์ทางสังคมของวัยรุ่น Gen Z,Learning Activity Design for Social Self-Concept Development of Generation Z Teenagers,2024
SRU00620,การตัดต่อวีดิทัศน์ดิจิทัลด้วยโปรแกรม Sony Vegas,Digital Video Editing with Sony Vegas,2023
SRU00615,หลักเกณฑ์วิธีการที่ดีในการผลิตอาหาร,Good Manufacturing Practice,2023
SRU00613,การตลาดดิจิทัลสำหรับผู้ประกอบการธุรกิจชุมชน,Digital Marketing for Community Business Entrepreneur,2023
SRU00612,การจัดการจดหมายเหตุและวัตถุพิพิธภัณฑ์ท้องถิ่น,Management of Local Archive and Museum Objects,2023
SRU00610,การจัดการธุรกิจร้านกาแฟ,Coffee Shop Business Management,2024
SRU00609,การบริหารโครงการ IT แบบมืออาชีพ,Professional IT Project Management,2023
SRU00607,การสมรสตามกฎหมายไทย,Thai marriage law,2024
SRU00604,พิษวิทยาอาชีวอนามัยพื้นฐาน,Introduction to Occupational Toxicology,2023
SRU00599,การวิเคราะห์ข้อมูลเบื้องต้นด้วยเวก้า,Basic Data Analysis with Weka,2020
SRU00598,การออกแบบบทเรียนมัลติมีเดียและแอนิเมชันเพื่อการศึกษา,Design of Multimedia Courseware and Animation for Education,2020
SRU00597,ภาษาอังกฤษเพื่อการพยาบาลพื้นฐาน,English for Fundamental Nursing,2020
SRU00596,การจัดการสารสนเทศสำนักงาน,Office Information Management,2020
SRU00595,การเตรียมสอบประกาศนียบัตร MOS : MS Excel 2013,MS Excel 2013 | MOS Certificate : MS Excel 2013,2020
SKRU00587,ภาษาอาร์และการวิเคราะห์ข้อมูล,R Programming for Data Analysis,2023
SKRU00586,การออกแบบและสร้างสื่อ Interactive เพื่อการเรียนการสอนบน Smartphone,Interactive multimedia For education on smartphone,2021
SKCC00584,โปรแกรมคอมพิวเตอร์สำเร็จรูป,Computer Program,2023
SKCC00583,สื่อสารด้วยภาษากัมพูชาง่ายนิดเดียว,Communicate with Cambodia language very easy,2022
SKCC00582,เส้นสายใยรัก ผ้าทอหันทราย,Hun Sai’s Hand-woven Fabric,2022
SDU00580,อาหารอาเซียน,ASEAN FOOD,2020
SDU00579,พฤติกรรมการดูแลตนเองเพื่อป้องกันโรคเบาหวาน,Self-care behaviors for diabetes prevention,2020
SDU00578,การบริการอาหารและเครื่องดื่ม,Food and Beverage Service,2020
SDU00577,การดูแลแบบประคับประคอง,Palliative care,2020
SCT00576,ผู้ประกอบการร้านค้าออนไลน์,e-Commerce for Entrepreneurs,2020
